{"approval_mode":"adapter","approval_surface":{"adapter_id":"slack-reactions","credential_ref":"file:/private/slack-token","instance_id":"founder-approval","settings":{"approve_reaction":"white_check_mark","channel_id":"C123APPROVALS","reject_reaction":"x","request_timeout_ms":60000,"reviewer":{"name":"Founder","slack_user_id":"U123FOUNDER"}}},"decision_processor":{"adapter_id":"structured-text","instance_id":"primary","settings":{}},"delivery_surfaces":[{"adapter_id":"slack","credential_ref":"file:/private/slack-token","instance_id":"team-decisions","settings":{"channel_id":"C123DECISIONS","request_timeout_ms":60000}}],"lane":"team-product","meeting_sources":[{"adapter_id":"granola","credential_ref":"file:/private/granola-token","instance_id":"primary","settings":{"base_url":"https://api.granola.test/v1","cursor_overlap_ms":0,"page_size":1,"request_timeout_ms":15000}}],"schema_version":1,"state_dir":""}
